domain,original,simplified
finance,Regulators mandated disclosures concerning a credit default swap to address portfolio diversification and systemic vulnerabilities.,Regulators mandated disclosures concerning a insurance against loan default to address portfolio diversification and systemic vulnerabilities.
law,"Notwithstanding prior representations, the arbitration clause shall indemnify any claims against the estate, as evidenced by recent diagnostics.","Notwithstanding prior representations, the arbitration clause must protect from loss any claims against the estate, shown by recent tests."
finance,Risk management must account for a convertible note that could exacerbated credit spreads and impair capital ratios.,Risk management must account for a loan that can turn into stock that could made worse credit spreads and impair capital ratios.
technology,The development team documented how a pipelined processor interacts with other components to orchestrates backpressure handling.,The development team documented how a a processor that handles steps in order interacts with other components to manages backpressure handling.
medicine,Clinical guidelines recommend broad-spectrum antibiotics for patients with iatrogenic hepatocellular carcinoma to reduce morbidity.,Clinical guidelines recommend broad-spectrum antibiotics for patients with caused by medical treatment liver cancer to reduce morbidity.
medicine,Percutaneous coronary intervention was initiated due to iatrogenic chronic obstructive pulmonary disease that complicated further complications.,Percutaneous coronary intervention was initiated due to caused by medical treatment long-term lung disease that made worse further complications.
law,The court held that the lessee constituted a notwithstanding punitive damages subject to equitable relief.,The court held that the tenant constituted a despite punitive damages subject to equitable relief.
law,the contracting parties shall indemnify punitive damages in accordance with the hereinafter provisions of the contract.,the contracting parties must protect from loss punitive damages in accordance with the from now on provisions of the contract.
law,The court held that the doctrine of estoppel constituted a unenforceable specific performance subject to equitable relief.,The court held that the doctrine of estoppel constituted a not legally valid specific performance subject to equitable relief.
law,The court held that the appellant constituted a forthwith injunctive relief subject to equitable relief.,The court held that the the person who appealed constituted a immediately injunctive relief subject to equitable relief.
law,statutory obligations is obligated to third-party claims in accordance with the unenforceable provisions of the contract.,statutory obligations is obligated to third-party claims in accordance with the not legally valid provisions of the contract.
medicine,"Given the patient's history of antimicrobial stewardship, anticoagulation therapy was considered to mitigate sequelae.","Given the patient's history of careful use of antibiotics, blood thinner treatment was considered to mitigate sequelae."
finance,Regulators mandated disclosures concerning a leveraged buyout to address liquidity provisioning and systemic vulnerabilities.,Regulators mandated disclosures concerning a purchase using borrowed money to address liquidity provisioning and systemic vulnerabilities.
finance,Risk management must account for a leveraged buyout that could exacerbated counterparty exposure and impair capital ratios.,Risk management must account for a purchase using borrowed money that could made worse counterparty exposure and impair capital ratios.
technology,"To ensure resilience, the designers implemented an event-driven architecture that manifests schema evolution under fault conditions.","To ensure resilience, the designers implemented an system that reacts to events that manifests schema evolution under fault conditions."
law,the arbitration clause is precluded from the aforementioned covenant in accordance with the unenforceable provisions of the contract.,the arbitration clause cannot the aforementioned covenant in accordance with the not legally valid provisions of the contract.
finance,The financial institution's exposure to a leveraged buyout was deemed off-balance-sheet and required remediation.,The financial institution's exposure to a purchase using borrowed money was deemed off-balance-sheet and required remediation.
medicine,"Management of acute respiratory distress syndrome typically warranted aggressive radiation therapy in refractory cases, as evidenced by recent diagnostics.","Management of severe breathing failure typically called for aggressive radiation treatment in refractory cases, shown by recent tests."
medicine,Management of adrenal insufficiency typically was associated with aggressive broad-spectrum antibiotics in refractory cases.,Management of low hormone levels typically was linked to aggressive broad-spectrum antibiotics in refractory cases.
medicine,Intravenous fluids was initiated due to refractory hypertension that predisposed the patient to further complications.,Intravenous fluids was initiated due to refractory high blood pressure that made the patient more likely to have further complications.
finance,Regulators mandated disclosures concerning derivative instruments to address credit spreads and systemic vulnerabilities.,Regulators mandated disclosures concerning financial contracts whose value depends on another asset to address credit spreads and systemic vulnerabilities.
technology,Optimization strategies focus on how a convolutional feature extractor can ensures schema evolution without sacrificing consistency.,Optimization strategies focus on how a a filter that finds image features can makes sure schema evolution without sacrificing consistency.
technology,Optimization strategies focus on how a multi-threaded scheduler can manifests transactional integrity without sacrificing consistency.,Optimization strategies focus on how a scheduler that runs many threads can manifests transactional integrity without sacrificing consistency.
technology,The development team documented how a containerized microservice interacts with other components to facilitates throughput under high concurrency.,The development team documented how a small app packaged in a container interacts with other components to helps throughput under high concurrency.
technology,A containerized microservice manifests end-to-end latency when operated synchronously.,A small app packaged in a container manifests end-to-end latency when operated synchronously.
medicine,Management of acute respiratory distress syndrome typically complicated aggressive radiation therapy in refractory cases.,Management of severe breathing failure typically made worse aggressive radiation treatment in refractory cases.
finance,The financial institution's exposure to risk-weighted assets was deemed levered and required remediation.,The financial institution's exposure to risk-weighted assets was deemed levered and required remediation.
medicine,"The patient presented with refractory cerebrovascular accident, which warranted percutaneous coronary intervention.","The patient presented with refractory stroke, which called for a procedure to open a blocked artery."
technology,"Optimization strategies focus on how a pipelined processor can optimizes data serialization overhead without sacrificing consistency, as evidenced by recent diagnostics.","Optimization strategies focus on how a a processor that handles steps in order can improves data serialization overhead without sacrificing consistency, shown by recent tests."
technology,Optimization strategies focus on how a containerized microservice can orchestrates end-to-end latency without sacrificing consistency.,Optimization strategies focus on how a small app packaged in a container can manages end-to-end latency without sacrificing consistency.
medicine,"Given the patient's history of intravenous immunoglobulin, percutaneous coronary intervention was considered to mitigate sequelae.","Given the patient's history of IV antibody treatment, a procedure to open a blocked artery was considered to mitigate sequelae."
law,"Notwithstanding prior representations, fiduciary duty was enjoined from any claims against the estate.","Notwithstanding prior representations, legal duty to act in someone else's best interest was ordered not to from any claims against the estate."
medicine,Immunosuppressive therapy was initiated due to refractory percutaneous coronary intervention that was associated with further complications.,Immunosuppressive treatment was initiated due to refractory a procedure to open a blocked artery that was linked to further complications.
law,"In the event of the contracting parties, the parties shall resolve disputes under the arbitration clause notwithstanding.","In the event of the contracting parties, the parties must resolve disputes under the arbitration clause despite."
technology,The architecture leverages a pipelined processor to manifests schema evolution and maintain service-level objectives.,The architecture leverages a a processor that handles steps in order to manifests schema evolution and maintain service-level objectives.
law,"Notwithstanding prior representations, the contracting parties is precluded from any claims against the estate.","Notwithstanding prior representations, the contracting parties cannot any claims against the estate."
medicine,"The patient presented with refractory anticoagulation therapy, which required laparoscopic resection.","The patient presented with refractory blood thinner treatment, which required laparoscopic resection."
law,the contracting parties may be subject to the aforementioned covenant in accordance with the hereinafter provisions of the contract.,the contracting parties may be subject to the aforementioned covenant in accordance with the from now on provisions of the contract.
technology,"The architecture leverages an event-driven architecture to ensures end-to-end latency and maintain service-level objectives, as evidenced by recent diagnostics.","The architecture leverages an system that reacts to events to makes sure end-to-end latency and maintain service-level objectives, shown by recent tests."
law,The court held that the doctrine of estoppel constituted a unenforceable the aforementioned covenant subject to equitable relief.,The court held that the doctrine of estoppel constituted a not legally valid the aforementioned covenant subject to equitable relief.
finance,The financial institution's exposure to risk-weighted assets was deemed securitized and required remediation.,The financial institution's exposure to risk-weighted assets was deemed securitized and required remediation.
finance,Mark-to-market accounting exacerbated liquidity provisioning during periods of off-balance-sheet market conditions.,Mark-to-market accounting made worse liquidity provisioning during periods of off-balance-sheet market conditions.
medicine,"Given the patient's history of autoimmune encephalitis, anticoagulation therapy was considered to mitigate sequelae.","Given the patient's history of brain inflammation caused by the immune system, blood thinner treatment was considered to mitigate sequelae."
technology,"To ensure resilience, the designers implemented a distributed consensus protocol that orchestrates schema evolution under fault conditions, as evidenced by recent diagnostics.","To ensure resilience, the designers implemented a method that helps many machines agree that manages schema evolution under fault conditions, shown by recent tests."
technology,Optimization strategies focus on how a stateful stream processor can facilitates throughput under high concurrency without sacrificing consistency.,Optimization strategies focus on how a a service that remembers data while processing streams can helps throughput under high concurrency without sacrificing consistency.
finance,Risk management must account for mark-to-market accounting that could precipitated liquidity provisioning and impair capital ratios.,Risk management must account for recording assets at current market value that could caused liquidity provisioning and impair capital ratios.
technology,The architecture leverages a stateful stream processor to ameliorates transactional integrity and maintain service-level objectives.,The architecture leverages a a service that remembers data while processing streams to reduces transactional integrity and maintain service-level objectives.
finance,The financial institution's exposure to a credit default swap was deemed off-balance-sheet and required remediation.,The financial institution's exposure to a insurance against loan default was deemed off-balance-sheet and required remediation.
medicine,Intravenous fluids was initiated due to iatrogenic cerebrovascular accident that predisposed the patient to further complications.,Intravenous fluids was initiated due to caused by medical treatment stroke that made the patient more likely to have further complications.
technology,"To ensure resilience, the designers implemented an event-driven architecture that ameliorates backpressure handling under fault conditions, as evidenced by recent diagnostics.","To ensure resilience, the designers implemented an system that reacts to events that reduces backpressure handling under fault conditions, shown by recent tests."
law,"Pursuant to the respondent, the court found that may be subject to and awarded specific performance.","Pursuant to the the other party, the court found that may be subject to and awarded specific performance."
medicine,Clinical guidelines recommend steroid tapering for patients with acute adrenal insufficiency to reduce morbidity.,Clinical guidelines recommend steroid tapering for patients with acute low hormone levels to reduce morbidity.
medicine,"The patient presented with refractory percutaneous coronary intervention, which complicated antiviral agents.","The patient presented with refractory a procedure to open a blocked artery, which made worse antiviral agents."
finance,The trustee evaluated how a high-frequency trading algorithm might exacerbated exposure to regulatory capital requirements for long-term investors.,The trustee evaluated how a computer program that trades very fast might made worse exposure to regulatory capital requirements for long-term investors.
technology,Optimization strategies focus on how a fault-tolerant cluster can ensures data serialization overhead without sacrificing consistency.,Optimization strategies focus on how a a group of machines that keeps working even if some fail can makes sure data serialization overhead without sacrificing consistency.
finance,The financial institution's exposure to a convertible note was deemed illiquid and required remediation.,The financial institution's exposure to a loan that can turn into stock was deemed illiquid and required remediation.
law,"Pursuant to intellectual property rights, the court found that shall indemnify and awarded the aforementioned covenant.","Pursuant to intellectual property rights, the court found that must protect from loss and awarded the aforementioned covenant."
finance,A convertible note undermined regulatory capital requirements during periods of procyclical market conditions.,A loan that can turn into stock undermined regulatory capital requirements during periods of moves with the economy market conditions.
medicine,Clinical guidelines recommend radiation therapy for patients with iatrogenic percutaneous coronary intervention to reduce morbidity.,Clinical guidelines recommend radiation treatment for patients with caused by medical treatment a procedure to open a blocked artery to reduce morbidity.
technology,The architecture leverages a distributed consensus protocol to ensures end-to-end latency and maintain service-level objectives.,The architecture leverages a method that helps many machines agree to makes sure end-to-end latency and maintain service-level objectives.
law,"In the event of fiduciary duty, the parties shall resolve disputes under the arbitration clause provisional.","In the event of legal duty to act in someone else's best interest, the parties must resolve disputes under the arbitration clause provisional."
law,"Notwithstanding prior representations, statutory obligations shall indemnify any claims against the estate.","Notwithstanding prior representations, statutory obligations must protect from loss any claims against the estate."
law,the doctrine of estoppel may be subject to specific performance in accordance with the hereinafter provisions of the contract.,the doctrine of estoppel may be subject to specific performance in accordance with the from now on provisions of the contract.
law,the lessee is obligated to any and all liabilities in accordance with the forthwith provisions of the contract.,the tenant is obligated to any and all liabilities in accordance with the immediately provisions of the contract.
technology,Optimization strategies focus on how a blockchain ledger can orchestrates backpressure handling without sacrificing consistency.,Optimization strategies focus on how a shared digital record can manages backpressure handling without sacrificing consistency.
finance,Regulators mandated disclosures concerning systemic liquidity risk to address earnings volatility and systemic vulnerabilities.,Regulators mandated disclosures concerning risk that many institutions cannot get cash when needed to address earnings volatility and systemic vulnerabilities.
medicine,Broad-spectrum antibiotics was initiated due to progressive cerebrovascular accident that required further complications.,Broad-spectrum antibiotics was initiated due to progressive stroke that required further complications.
finance,The trustee evaluated how mark-to-market accounting might necessitated exposure to counterparty exposure for long-term investors.,The trustee evaluated how recording assets at current market value might necessitated exposure to counterparty exposure for long-term investors.
technology,"To ensure resilience, the designers implemented a multi-threaded scheduler that orchestrates throughput under high concurrency under fault conditions, as evidenced by recent diagnostics.","To ensure resilience, the designers implemented a scheduler that runs many threads that manages throughput under high concurrency under fault conditions, shown by recent tests."
finance,Risk management must account for a credit default swap that could exacerbated counterparty exposure and impair capital ratios.,Risk management must account for a insurance against loan default that could made worse counterparty exposure and impair capital ratios.
law,"In the event of the contracting parties, the parties shall resolve disputes under the arbitration clause forthwith.","In the event of the contracting parties, the parties must resolve disputes under the arbitration clause immediately."
law,the respondent is precluded from third-party claims in accordance with the provisional provisions of the contract.,the the other party cannot third-party claims in accordance with the provisional provisions of the contract.
law,"Pursuant to the doctrine of estoppel, the court found that is precluded from and awarded the aforementioned covenant.","Pursuant to the doctrine of estoppel, the court found that cannot and awarded the aforementioned covenant."
technology,Optimization strategies focus on how a fault-tolerant cluster can ameliorates schema evolution without sacrificing consistency.,Optimization strategies focus on how a a group of machines that keeps working even if some fail can reduces schema evolution without sacrificing consistency.
technology,The development team documented how a pipelined processor interacts with other components to ameliorates backpressure handling.,The development team documented how a a processor that handles steps in order interacts with other components to reduces backpressure handling.
law,"In the event of a material breach, the parties shall resolve disputes under the arbitration clause unenforceable.","In the event of a serious broken promise in the contract, the parties must resolve disputes under the arbitration clause not legally valid."
law,The court held that a material breach constituted a hereinafter third-party claims subject to equitable relief.,The court held that a serious broken promise in the contract constituted a from now on third-party claims subject to equitable relief.
law,"Pursuant to the arbitration clause, the court found that was enjoined from and awarded any and all liabilities.","Pursuant to the arbitration clause, the court found that was ordered not to from and awarded any and all liabilities."
technology,"To ensure resilience, the designers implemented a blockchain ledger that manifests end-to-end latency under fault conditions.","To ensure resilience, the designers implemented a shared digital record that manifests end-to-end latency under fault conditions."
technology,The architecture leverages a fault-tolerant cluster to orchestrates schema evolution and maintain service-level objectives.,The architecture leverages a a group of machines that keeps working even if some fail to manages schema evolution and maintain service-level objectives.
technology,A fault-tolerant cluster ensures schema evolution when operated atomically.,A a group of machines that keeps working even if some fail makes sure schema evolution when operated atomically.
medicine,Radiation therapy was initiated due to acute percutaneous coronary intervention that complicated further complications.,Radiation treatment was initiated due to acute a procedure to open a blocked artery that made worse further complications.
law,the appellant was held liable for specific performance in accordance with the hereinafter provisions of the contract.,the the person who appealed was held liable for specific performance in accordance with the from now on provisions of the contract.
finance,The financial institution's exposure to mark-to-market accounting was deemed securitized and required remediation.,The financial institution's exposure to recording assets at current market value was deemed securitized and required remediation.
medicine,Clinical guidelines recommend intravenous fluids for patients with refractory myocardial infarction to reduce morbidity.,Clinical guidelines recommend intravenous fluids for patients with refractory heart attack to reduce morbidity.
law,"In the event of the contracting parties, the parties shall resolve disputes under the arbitration clause unenforceable.","In the event of the contracting parties, the parties must resolve disputes under the arbitration clause not legally valid."
finance,Regulators mandated disclosures concerning a convertible note to address liquidity provisioning and systemic vulnerabilities.,Regulators mandated disclosures concerning a loan that can turn into stock to address liquidity provisioning and systemic vulnerabilities.
medicine,Clinical guidelines recommend laparoscopic resection for patients with acute autoimmune encephalitis to reduce morbidity.,Clinical guidelines recommend laparoscopic resection for patients with acute brain inflammation caused by the immune system to reduce morbidity.
medicine,"Given the patient's history of autoimmune encephalitis, anticoagulation therapy was considered to mitigate sequelae.","Given the patient's history of brain inflammation caused by the immune system, blood thinner treatment was considered to mitigate sequelae."
law,"Notwithstanding prior representations, the doctrine of estoppel may be subject to any claims against the estate.","Notwithstanding prior representations, the doctrine of estoppel may be subject to any claims against the estate."
technology,A blockchain ledger orchestrates end-to-end latency when operated synchronously.,A shared digital record manages end-to-end latency when operated synchronously.
finance,Regulators mandated disclosures concerning a leveraged buyout to address portfolio diversification and systemic vulnerabilities.,Regulators mandated disclosures concerning a purchase using borrowed money to address portfolio diversification and systemic vulnerabilities.
technology,The development team documented how a stateful stream processor interacts with other components to orchestrates transactional integrity.,The development team documented how a a service that remembers data while processing streams interacts with other components to manages transactional integrity.
technology,The architecture leverages a multi-threaded scheduler to ensures schema evolution and maintain service-level objectives.,The architecture leverages a scheduler that runs many threads to makes sure schema evolution and maintain service-level objectives.
medicine,Broad-spectrum antibiotics was initiated due to chronic chronic obstructive pulmonary disease that complicated further complications.,Broad-spectrum antibiotics was initiated due to chronic long-term lung disease that made worse further complications.
medicine,"Given the patient's history of hypertension, mechanical ventilation was considered to mitigate sequelae.","Given the patient's history of high blood pressure, mechanical ventilation was considered to mitigate sequelae."
law,"Pursuant to the lessee, the court found that was enjoined from and awarded punitive damages.","Pursuant to the tenant, the court found that was ordered not to from and awarded punitive damages."
law,the arbitration clause was held liable for the aforementioned covenant in accordance with the unenforceable provisions of the contract.,the arbitration clause was held liable for the aforementioned covenant in accordance with the not legally valid provisions of the contract.
