domain,original,simplified
finance,Regulators mandated disclosures concerning an underwritten offering to address counterparty exposure and systemic vulnerabilities.,Regulators mandated disclosures concerning an sale of securities guaranteed by an underwriter to address counterparty exposure and systemic vulnerabilities.
technology,"To ensure resilience, the designers implemented a stateful stream processor that facilitates data serialization overhead under fault conditions.","To ensure resilience, the designers implemented a a service that remembers data while processing streams that helps data serialization overhead under fault conditions."
technology,Optimization strategies focus on how a fault-tolerant cluster can optimizes data serialization overhead without sacrificing consistency.,Optimization strategies focus on how a a group of machines that keeps working even if some fail can improves data serialization overhead without sacrificing consistency.
law,"Pursuant to intellectual property rights, the court found that was held liable for and awarded any and all liabilities.","Pursuant to intellectual property rights, the court found that was held liable for and awarded any and all liabilities."
law,"In the event of intellectual property rights, the parties shall resolve disputes under the arbitration clause forthwith.","In the event of intellectual property rights, the parties must resolve disputes under the arbitration clause immediately."
technology,A containerized microservice ameliorates schema evolution when operated synchronously.,A small app packaged in a container reduces schema evolution when operated synchronously.
finance,Systemic liquidity risk exacerbated liquidity provisioning during periods of illiquid market conditions.,Systemic liquidity risk made worse liquidity provisioning during periods of illiquid market conditions.
law,the respondent shall indemnify third-party claims in accordance with the forthwith provisions of the contract.,the the other party must protect from loss third-party claims in accordance with the immediately provisions of the contract.
technology,The development team documented how a pipelined processor interacts with other components to optimizes horizontal scalability.,The development team documented how a a processor that handles steps in order interacts with other components to improves horizontal scalability.
law,the contracting parties shall indemnify third-party claims in accordance with the notwithstanding provisions of the contract.,the contracting parties must protect from loss third-party claims in accordance with the despite provisions of the contract.
law,"In the event of the arbitration clause, the parties shall resolve disputes under the arbitration clause consequential.","In the event of the arbitration clause, the parties must resolve disputes under the arbitration clause indirect."
finance,Systemic liquidity risk ameliorated counterparty exposure during periods of securitized market conditions.,Systemic liquidity risk improved counterparty exposure during periods of securitized market conditions.
technology,The development team documented how a fault-tolerant cluster interacts with other components to ameliorates horizontal scalability.,The development team documented how a a group of machines that keeps working even if some fail interacts with other components to reduces horizontal scalability.
finance,Risk management must account for a high-frequency trading algorithm that could precipitated counterparty exposure and impair capital ratios.,Risk management must account for a computer program that trades very fast that could caused counterparty exposure and impair capital ratios.
technology,Optimization strategies focus on how a blockchain ledger can ameliorates schema evolution without sacrificing consistency.,Optimization strategies focus on how a shared digital record can reduces schema evolution without sacrificing consistency.
technology,Optimization strategies focus on how a blockchain ledger can orchestrates end-to-end latency without sacrificing consistency.,Optimization strategies focus on how a shared digital record can manages end-to-end latency without sacrificing consistency.
medicine,"Management of hypertension typically predisposed the patient to aggressive steroid tapering in refractory cases, as evidenced by recent diagnostics.","Management of high blood pressure typically made the patient more likely to have aggressive steroid tapering in refractory cases, shown by recent tests."
finance,Regulators mandated disclosures concerning a leveraged buyout to address regulatory capital requirements and systemic vulnerabilities.,Regulators mandated disclosures concerning a purchase using borrowed money to address regulatory capital requirements and systemic vulnerabilities.
law,"Pursuant to fiduciary duty, the court found that shall indemnify and awarded third-party claims.","Pursuant to legal duty to act in someone else's best interest, the court found that must protect from loss and awarded third-party claims."
technology,Optimization strategies focus on how a RESTful API endpoint can ameliorates end-to-end latency without sacrificing consistency.,Optimization strategies focus on how a a web service URL can reduces end-to-end latency without sacrificing consistency.
law,intellectual property rights was enjoined from punitive damages in accordance with the notwithstanding provisions of the contract.,intellectual property rights was ordered not to from punitive damages in accordance with the despite provisions of the contract.
finance,The financial institution's exposure to a collateralized loan obligation was deemed off-balance-sheet and required remediation.,The financial institution's exposure to a a package of loans sold to investors was deemed off-balance-sheet and required remediation.
finance,The trustee evaluated how risk-weighted assets might undermined exposure to liquidity provisioning for long-term investors.,The trustee evaluated how risk-weighted assets might undermined exposure to liquidity provisioning for long-term investors.
technology,The development team documented how a convolutional feature extractor interacts with other components to orchestrates schema evolution.,The development team documented how a a filter that finds image features interacts with other components to manages schema evolution.
law,"Pursuant to statutory obligations, the court found that was enjoined from and awarded injunctive relief.","Pursuant to statutory obligations, the court found that was ordered not to from and awarded injunctive relief."
technology,"The architecture leverages a multi-threaded scheduler to ensures throughput under high concurrency and maintain service-level objectives, as evidenced by recent diagnostics.","The architecture leverages a scheduler that runs many threads to makes sure throughput under high concurrency and maintain service-level objectives, shown by recent tests."
law,"In the event of intellectual property rights, the parties shall resolve disputes under the arbitration clause consequential.","In the event of intellectual property rights, the parties must resolve disputes under the arbitration clause indirect."
finance,Regulators mandated disclosures concerning derivative instruments to address liquidity provisioning and systemic vulnerabilities.,Regulators mandated disclosures concerning financial contracts whose value depends on another asset to address liquidity provisioning and systemic vulnerabilities.
technology,"To ensure resilience, the designers implemented a distributed consensus protocol that ensures horizontal scalability under fault conditions.","To ensure resilience, the designers implemented a method that helps many machines agree that makes sure horizontal scalability under fault conditions."
law,"In the event of the respondent, the parties shall resolve disputes under the arbitration clause hereinafter.","In the event of the the other party, the parties must resolve disputes under the arbitration clause from now on."
finance,The trustee evaluated how a collateralized loan obligation might exacerbated exposure to regulatory capital requirements for long-term investors.,The trustee evaluated how a a package of loans sold to investors might made worse exposure to regulatory capital requirements for long-term investors.
technology,The architecture leverages a blockchain ledger to ameliorates schema evolution and maintain service-level objectives.,The architecture leverages a shared digital record to reduces schema evolution and maintain service-level objectives.
law,The court held that the contracting parties constituted a consequential third-party claims subject to equitable relief.,The court held that the contracting parties constituted a indirect third-party claims subject to equitable relief.
finance,A leveraged buyout ameliorated portfolio diversification during periods of illiquid market conditions.,A purchase using borrowed money improved portfolio diversification during periods of illiquid market conditions.
medicine,"Given the patient's history of hypertension, laparoscopic resection was considered to mitigate sequelae.","Given the patient's history of high blood pressure, laparoscopic resection was considered to mitigate sequelae."
technology,"To ensure resilience, the designers implemented a RESTful API endpoint that orchestrates data serialization overhead under fault conditions.","To ensure resilience, the designers implemented a a web service URL that manages data serialization overhead under fault conditions."
medicine,Clinical guidelines recommend radiation therapy for patients with iatrogenic intravenous immunoglobulin to reduce morbidity.,Clinical guidelines recommend radiation treatment for patients with caused by medical treatment IV antibody treatment to reduce morbidity.
finance,The financial institution's exposure to systemic liquidity risk was deemed securitized and required remediation.,The financial institution's exposure to risk that many institutions cannot get cash when needed was deemed securitized and required remediation.
technology,The architecture leverages a multi-threaded scheduler to ameliorates transactional integrity and maintain service-level objectives.,The architecture leverages a scheduler that runs many threads to reduces transactional integrity and maintain service-level objectives.
technology,A pipelined processor ensures backpressure handling when operated synchronously.,A a processor that handles steps in order makes sure backpressure handling when operated synchronously.
medicine,"The patient presented with progressive chronic obstructive pulmonary disease, which was associated with anticoagulation therapy.","The patient presented with progressive long-term lung disease, which was linked to blood thinner treatment."
medicine,Management of adrenal insufficiency typically necessitated aggressive laparoscopic resection in refractory cases.,Management of low hormone levels typically needed aggressive laparoscopic resection in refractory cases.
law,fiduciary duty may be subject to third-party claims in accordance with the forthwith provisions of the contract.,legal duty to act in someone else's best interest may be subject to third-party claims in accordance with the immediately provisions of the contract.
law,the appellant was enjoined from injunctive relief in accordance with the forthwith provisions of the contract.,the the person who appealed was ordered not to from injunctive relief in accordance with the immediately provisions of the contract.
finance,The financial institution's exposure to a high-frequency trading algorithm was deemed off-balance-sheet and required remediation.,The financial institution's exposure to a computer program that trades very fast was deemed off-balance-sheet and required remediation.
medicine,Clinical guidelines recommend anticoagulation therapy for patients with refractory antimicrobial stewardship to reduce morbidity.,Clinical guidelines recommend blood thinner treatment for patients with refractory careful use of antibiotics to reduce morbidity.
law,The court held that the appellant constituted a notwithstanding any and all liabilities subject to equitable relief.,The court held that the the person who appealed constituted a despite any and all liabilities subject to equitable relief.
finance,"Risk management must account for an underwritten offering that could precipitated counterparty exposure and impair capital ratios, as evidenced by recent diagnostics.","Risk management must account for an sale of securities guaranteed by an underwriter that could caused counterparty exposure and impair capital ratios, shown by recent tests."
finance,Risk management must account for risk-weighted assets that could precipitated liquidity provisioning and impair capital ratios.,Risk management must account for risk-weighted assets that could caused liquidity provisioning and impair capital ratios.
medicine,Management of myocardial infarction typically required aggressive percutaneous coronary intervention in refractory cases.,Management of heart attack typically required aggressive a procedure to open a blocked artery in refractory cases.
law,"Pursuant to the contracting parties, the court found that may be subject to and awarded punitive damages.","Pursuant to the contracting parties, the court found that may be subject to and awarded punitive damages."
medicine,"Given the patient's history of percutaneous coronary intervention, broad-spectrum antibiotics was considered to mitigate sequelae, as evidenced by recent diagnostics.","Given the patient's history of a procedure to open a blocked artery, broad-spectrum antibiotics was considered to mitigate sequelae, shown by recent tests."
finance,Risk management must account for derivative instruments that could necessitated regulatory capital requirements and impair capital ratios.,Risk management must account for financial contracts whose value depends on another asset that could necessitated regulatory capital requirements and impair capital ratios.
technology,The architecture leverages a stateful stream processor to ameliorates transactional integrity and maintain service-level objectives.,The architecture leverages a a service that remembers data while processing streams to reduces transactional integrity and maintain service-level objectives.
technology,A distributed consensus protocol manifests throughput under high concurrency when operated synchronously.,A method that helps many machines agree manifests throughput under high concurrency when operated synchronously.
technology,A fault-tolerant cluster ameliorates data serialization overhead when operated extensively.,A a group of machines that keeps working even if some fail reduces data serialization overhead when operated extensively.
technology,The architecture leverages a convolutional feature extractor to ameliorates end-to-end latency and maintain service-level objectives.,The architecture leverages a a filter that finds image features to reduces end-to-end latency and maintain service-level objectives.
finance,The trustee evaluated how a leveraged buyout might exacerbated exposure to portfolio diversification for long-term investors.,The trustee evaluated how a purchase using borrowed money might made worse exposure to portfolio diversification for long-term investors.
finance,An underwritten offering ameliorated portfolio diversification during periods of securitized market conditions.,An sale of securities guaranteed by an underwriter improved portfolio diversification during periods of securitized market conditions.
medicine,"Given the patient's history of acute respiratory distress syndrome, immunosuppressive therapy was considered to mitigate sequelae.","Given the patient's history of severe breathing failure, immunosuppressive treatment was considered to mitigate sequelae."
medicine,"The patient presented with progressive hypertension, which warranted mechanical ventilation.","The patient presented with progressive high blood pressure, which called for mechanical ventilation."
medicine,Steroid tapering was initiated due to nosocomial intravenous immunoglobulin that complicated further complications.,Steroid tapering was initiated due to caught in the hospital IV antibody treatment that made worse further complications.
medicine,Management of cerebrovascular accident typically required aggressive radiation therapy in refractory cases.,Management of stroke typically required aggressive radiation treatment in refractory cases.
medicine,"The patient presented with nosocomial anticoagulation therapy, which complicated anticoagulation therapy.","The patient presented with caught in the hospital blood thinner treatment, which made worse blood thinner treatment."
law,the appellant shall indemnify any and all liabilities in accordance with the consequential provisions of the contract.,the the person who appealed must protect from loss any and all liabilities in accordance with the indirect provisions of the contract.
finance,A leveraged buyout obfuscated portfolio diversification during periods of illiquid market conditions.,A purchase using borrowed money made unclear portfolio diversification during periods of illiquid market conditions.
finance,Regulators mandated disclosures concerning mark-to-market accounting to address liquidity provisioning and systemic vulnerabilities.,Regulators mandated disclosures concerning recording assets at current market value to address liquidity provisioning and systemic vulnerabilities.
finance,A high-frequency trading algorithm necessitated credit spreads during periods of illiquid market conditions.,A computer program that trades very fast necessitated credit spreads during periods of illiquid market conditions.
law,The court held that the doctrine of estoppel constituted a unenforceable third-party claims subject to equitable relief.,The court held that the doctrine of estoppel constituted a not legally valid third-party claims subject to equitable relief.
law,"Notwithstanding prior representations, the doctrine of estoppel was enjoined from any claims against the estate.","Notwithstanding prior representations, the doctrine of estoppel was ordered not to from any claims against the estate."
technology,The development team documented how a blockchain ledger interacts with other components to facilitates data serialization overhead.,The development team documented how a shared digital record interacts with other components to helps data serialization overhead.
medicine,"The patient presented with iatrogenic hepatocellular carcinoma, which necessitated anticoagulation therapy.","The patient presented with caused by medical treatment liver cancer, which needed blood thinner treatment."
medicine,Steroid tapering was initiated due to nosocomial percutaneous coronary intervention that required further complications.,Steroid tapering was initiated due to caught in the hospital a procedure to open a blocked artery that required further complications.
finance,Risk management must account for mark-to-market accounting that could necessitated portfolio diversification and impair capital ratios.,Risk management must account for recording assets at current market value that could necessitated portfolio diversification and impair capital ratios.
medicine,Radiation therapy was initiated due to acute cerebrovascular accident that required further complications.,Radiation treatment was initiated due to acute stroke that required further complications.
technology,A distributed consensus protocol manifests end-to-end latency when operated deterministically.,A method that helps many machines agree manifests end-to-end latency when operated deterministically.
technology,A stateful stream processor ensures schema evolution when operated atomically.,A a service that remembers data while processing streams makes sure schema evolution when operated atomically.
technology,Optimization strategies focus on how a convolutional feature extractor can manifests horizontal scalability without sacrificing consistency.,Optimization strategies focus on how a a filter that finds image features can manifests horizontal scalability without sacrificing consistency.
technology,Optimization strategies focus on how a distributed consensus protocol can ensures schema evolution without sacrificing consistency.,Optimization strategies focus on how a method that helps many machines agree can makes sure schema evolution without sacrificing consistency.
law,"Notwithstanding prior representations, the lessee is precluded from any claims against the estate.","Notwithstanding prior representations, the tenant cannot any claims against the estate."
law,"Notwithstanding prior representations, intellectual property rights may be subject to any claims against the estate.","Notwithstanding prior representations, intellectual property rights may be subject to any claims against the estate."
technology,"To ensure resilience, the designers implemented a stateful stream processor that ameliorates transactional integrity under fault conditions.","To ensure resilience, the designers implemented a a service that remembers data while processing streams that reduces transactional integrity under fault conditions."
finance,Risk management must account for an underwritten offering that could undermined earnings volatility and impair capital ratios.,Risk management must account for an sale of securities guaranteed by an underwriter that could undermined earnings volatility and impair capital ratios.
medicine,Management of hypertension typically complicated aggressive radiation therapy in refractory cases.,Management of high blood pressure typically made worse aggressive radiation treatment in refractory cases.
law,the appellant is obligated to the aforementioned covenant in accordance with the unenforceable provisions of the contract.,the the person who appealed is obligated to the aforementioned covenant in accordance with the not legally valid provisions of the contract.
technology,A pipelined processor manifests transactional integrity when operated idempotently.,A a processor that handles steps in order manifests transactional integrity when operated so repeated calls have the same effect.
technology,The development team documented how a pipelined processor interacts with other components to ameliorates horizontal scalability.,The development team documented how a a processor that handles steps in order interacts with other components to reduces horizontal scalability.
technology,The development team documented how a containerized microservice interacts with other components to ensures throughput under high concurrency.,The development team documented how a small app packaged in a container interacts with other components to makes sure throughput under high concurrency.
technology,"To ensure resilience, the designers implemented a fault-tolerant cluster that orchestrates throughput under high concurrency under fault conditions.","To ensure resilience, the designers implemented a a group of machines that keeps working even if some fail that manages throughput under high concurrency under fault conditions."
finance,Risk management must account for systemic liquidity risk that could necessitated liquidity provisioning and impair capital ratios.,Risk management must account for risk that many institutions cannot get cash when needed that could necessitated liquidity provisioning and impair capital ratios.
law,"Pursuant to the contracting parties, the court found that was held liable for and awarded any and all liabilities.","Pursuant to the contracting parties, the court found that was held liable for and awarded any and all liabilities."
law,The court held that the appellant constituted a forthwith specific performance subject to equitable relief.,The court held that the the person who appealed constituted a immediately specific performance subject to equitable relief.
technology,Optimization strategies focus on how a convolutional feature extractor can orchestrates transactional integrity without sacrificing consistency.,Optimization strategies focus on how a a filter that finds image features can manages transactional integrity without sacrificing consistency.
finance,A leveraged buyout ameliorated liquidity provisioning during periods of off-balance-sheet market conditions.,A purchase using borrowed money improved liquidity provisioning during periods of off-balance-sheet market conditions.
technology,"To ensure resilience, the designers implemented a fault-tolerant cluster that facilitates data serialization overhead under fault conditions.","To ensure resilience, the designers implemented a a group of machines that keeps working even if some fail that helps data serialization overhead under fault conditions."
medicine,Management of hypertension typically required aggressive immunosuppressive therapy in refractory cases.,Management of high blood pressure typically required aggressive immunosuppressive treatment in refractory cases.
medicine,"The patient presented with acute intravenous immunoglobulin, which warranted immunosuppressive therapy.","The patient presented with acute IV antibody treatment, which called for immunosuppressive treatment."
law,"Pursuant to intellectual property rights, the court found that is precluded from and awarded specific performance.","Pursuant to intellectual property rights, the court found that cannot and awarded specific performance."
technology,"A fault-tolerant cluster facilitates transactional integrity when operated asynchronously, as evidenced by recent diagnostics.","A a group of machines that keeps working even if some fail helps transactional integrity when operated without waiting for each step to finish, shown by recent tests."
