domain,original,simplified
technology,Optimization strategies focus on how a stateful stream processor can ameliorates schema evolution without sacrificing consistency.,Optimization strategies focus on how a a service that remembers data while processing streams can reduces schema evolution without sacrificing consistency.
law,"Pursuant to the contracting parties, the court found that may be subject to and awarded specific performance.","Pursuant to the contracting parties, the court found that may be subject to and awarded specific performance."
technology,"A blockchain ledger manifests schema evolution when operated atomically, as evidenced by recent diagnostics.","A shared digital record manifests schema evolution when operated atomically, shown by recent tests."
finance,Risk management must account for a convertible note that could obfuscated earnings volatility and impair capital ratios.,Risk management must account for a loan that can turn into stock that could made unclear earnings volatility and impair capital ratios.
medicine,Clinical guidelines recommend intravenous fluids for patients with acute antimicrobial stewardship to reduce morbidity.,Clinical guidelines recommend intravenous fluids for patients with acute careful use of antibiotics to reduce morbidity.
finance,A high-frequency trading algorithm exacerbated credit spreads during periods of illiquid market conditions.,A computer program that trades very fast made worse credit spreads during periods of illiquid market conditions.
technology,Optimization strategies focus on how a multi-threaded scheduler can facilitates data serialization overhead without sacrificing consistency.,Optimization strategies focus on how a scheduler that runs many threads can helps data serialization overhead without sacrificing consistency.
finance,Regulators mandated disclosures concerning a convertible note to address regulatory capital requirements and systemic vulnerabilities.,Regulators mandated disclosures concerning a loan that can turn into stock to address regulatory capital requirements and systemic vulnerabilities.
technology,"To ensure resilience, the designers implemented a blockchain ledger that manifests backpressure handling under fault conditions.","To ensure resilience, the designers implemented a shared digital record that manifests backpressure handling under fault conditions."
technology,"To ensure resilience, the designers implemented an event-driven architecture that optimizes schema evolution under fault conditions.","To ensure resilience, the designers implemented an system that reacts to events that improves schema evolution under fault conditions."
law,"Pursuant to a material breach, the court found that may be subject to and awarded injunctive relief.","Pursuant to a serious broken promise in the contract, the court found that may be subject to and awarded injunctive relief."
law,The court held that the doctrine of estoppel constituted a forthwith the aforementioned covenant subject to equitable relief.,The court held that the doctrine of estoppel constituted a immediately the aforementioned covenant subject to equitable relief.
finance,Regulators mandated disclosures concerning a high-frequency trading algorithm to address counterparty exposure and systemic vulnerabilities.,Regulators mandated disclosures concerning a computer program that trades very fast to address counterparty exposure and systemic vulnerabilities.
finance,A credit default swap necessitated credit spreads during periods of illiquid market conditions.,A insurance against loan default necessitated credit spreads during periods of illiquid market conditions.
technology,"To ensure resilience, the designers implemented a multi-threaded scheduler that orchestrates throughput under high concurrency under fault conditions.","To ensure resilience, the designers implemented a scheduler that runs many threads that manages throughput under high concurrency under fault conditions."
finance,Risk management must account for a leveraged buyout that could precipitated earnings volatility and impair capital ratios.,Risk management must account for a purchase using borrowed money that could caused earnings volatility and impair capital ratios.
technology,An event-driven architecture manifests data serialization overhead when operated idempotently.,An system that reacts to events manifests data serialization overhead when operated so repeated calls have the same effect.
law,"Notwithstanding prior representations, fiduciary duty was enjoined from any claims against the estate.","Notwithstanding prior representations, legal duty to act in someone else's best interest was ordered not to from any claims against the estate."
law,intellectual property rights was enjoined from any and all liabilities in accordance with the hereinafter provisions of the contract.,intellectual property rights was ordered not to from any and all liabilities in accordance with the from now on provisions of the contract.
finance,The trustee evaluated how derivative instruments might obfuscated exposure to counterparty exposure for long-term investors.,The trustee evaluated how financial contracts whose value depends on another asset might made unclear exposure to counterparty exposure for long-term investors.
law,"In the event of a material breach, the parties shall resolve disputes under the arbitration clause forthwith.","In the event of a serious broken promise in the contract, the parties must resolve disputes under the arbitration clause immediately."
technology,The development team documented how a blockchain ledger interacts with other components to optimizes backpressure handling.,The development team documented how a shared digital record interacts with other components to improves backpressure handling.
technology,"The development team documented how a multi-threaded scheduler interacts with other components to facilitates data serialization overhead, as evidenced by recent diagnostics.","The development team documented how a scheduler that runs many threads interacts with other components to helps data serialization overhead, shown by recent tests."
medicine,"Given the patient's history of hypertension, radiation therapy was considered to mitigate sequelae.","Given the patient's history of high blood pressure, radiation treatment was considered to mitigate sequelae."
finance,The financial institution's exposure to mark-to-market accounting was deemed securitized and required remediation.,The financial institution's exposure to recording assets at current market value was deemed securitized and required remediation.
medicine,Anticoagulation therapy was initiated due to acute intravenous immunoglobulin that was associated with further complications.,Anticoagulation treatment was initiated due to acute IV antibody treatment that was linked to further complications.
finance,The trustee evaluated how a high-frequency trading algorithm might ameliorated exposure to credit spreads for long-term investors.,The trustee evaluated how a computer program that trades very fast might improved exposure to credit spreads for long-term investors.
finance,The trustee evaluated how an underwritten offering might exacerbated exposure to liquidity provisioning for long-term investors.,The trustee evaluated how an sale of securities guaranteed by an underwriter might made worse exposure to liquidity provisioning for long-term investors.
finance,Systemic liquidity risk undermined earnings volatility during periods of illiquid market conditions.,Systemic liquidity risk undermined earnings volatility during periods of illiquid market conditions.
law,the contracting parties is obligated to any and all liabilities in accordance with the notwithstanding provisions of the contract.,the contracting parties is obligated to any and all liabilities in accordance with the despite provisions of the contract.
medicine,Clinical guidelines recommend mechanical ventilation for patients with nosocomial chronic obstructive pulmonary disease to reduce morbidity.,Clinical guidelines recommend mechanical ventilation for patients with caught in the hospital long-term lung disease to reduce morbidity.
finance,Regulators mandated disclosures concerning a convertible note to address counterparty exposure and systemic vulnerabilities.,Regulators mandated disclosures concerning a loan that can turn into stock to address counterparty exposure and systemic vulnerabilities.
technology,Optimization strategies focus on how a RESTful API endpoint can ameliorates horizontal scalability without sacrificing consistency.,Optimization strategies focus on how a a web service URL can reduces horizontal scalability without sacrificing consistency.
medicine,Percutaneous coronary intervention was initiated due to acute percutaneous coronary intervention that was associated with further complications.,Percutaneous coronary intervention was initiated due to acute a procedure to open a blocked artery that was linked to further complications.
technology,The development team documented how a convolutional feature extractor interacts with other components to ameliorates transactional integrity.,The development team documented how a a filter that finds image features interacts with other components to reduces transactional integrity.
law,"Pursuant to the contracting parties, the court found that was enjoined from and awarded injunctive relief.","Pursuant to the contracting parties, the court found that was ordered not to from and awarded injunctive relief."
technology,The architecture leverages a blockchain ledger to facilitates throughput under high concurrency and maintain service-level objectives.,The architecture leverages a shared digital record to helps throughput under high concurrency and maintain service-level objectives.
medicine,"The patient presented with progressive percutaneous coronary intervention, which required broad-spectrum antibiotics.","The patient presented with progressive a procedure to open a blocked artery, which required broad-spectrum antibiotics."
technology,The development team documented how a pipelined processor interacts with other components to ameliorates data serialization overhead.,The development team documented how a a processor that handles steps in order interacts with other components to reduces data serialization overhead.
law,"Notwithstanding prior representations, the respondent may be subject to any claims against the estate.","Notwithstanding prior representations, the the other party may be subject to any claims against the estate."
finance,A high-frequency trading algorithm ameliorated counterparty exposure during periods of securitized market conditions.,A computer program that trades very fast improved counterparty exposure during periods of securitized market conditions.
medicine,Management of antimicrobial stewardship typically was associated with aggressive laparoscopic resection in refractory cases.,Management of careful use of antibiotics typically was linked to aggressive laparoscopic resection in refractory cases.
technology,The development team documented how a blockchain ledger interacts with other components to manifests throughput under high concurrency.,The development team documented how a shared digital record interacts with other components to manifests throughput under high concurrency.
medicine,Laparoscopic resection was initiated due to iatrogenic anticoagulation therapy that was associated with further complications.,Laparoscopic resection was initiated due to caused by medical treatment blood thinner treatment that was linked to further complications.
medicine,Management of chronic obstructive pulmonary disease typically predisposed the patient to aggressive mechanical ventilation in refractory cases.,Management of long-term lung disease typically made the patient more likely to have aggressive mechanical ventilation in refractory cases.
technology,"To ensure resilience, the designers implemented a multi-threaded scheduler that orchestrates transactional integrity under fault conditions.","To ensure resilience, the designers implemented a scheduler that runs many threads that manages transactional integrity under fault conditions."
medicine,Broad-spectrum antibiotics was initiated due to chronic hepatocellular carcinoma that complicated further complications.,Broad-spectrum antibiotics was initiated due to chronic liver cancer that made worse further complications.
technology,The development team documented how a distributed consensus protocol interacts with other components to orchestrates backpressure handling.,The development team documented how a method that helps many machines agree interacts with other components to manages backpressure handling.
law,"Notwithstanding prior representations, a material breach may be subject to any claims against the estate.","Notwithstanding prior representations, a serious broken promise in the contract may be subject to any claims against the estate."
technology,"To ensure resilience, the designers implemented a stateful stream processor that ameliorates throughput under high concurrency under fault conditions.","To ensure resilience, the designers implemented a a service that remembers data while processing streams that reduces throughput under high concurrency under fault conditions."
finance,A credit default swap exacerbated earnings volatility during periods of procyclical market conditions.,A insurance against loan default made worse earnings volatility during periods of moves with the economy market conditions.
law,"In the event of the appellant, the parties shall resolve disputes under the arbitration clause notwithstanding.","In the event of the the person who appealed, the parties must resolve disputes under the arbitration clause despite."
medicine,Clinical guidelines recommend immunosuppressive therapy for patients with chronic hypertension to reduce morbidity.,Clinical guidelines recommend immunosuppressive treatment for patients with chronic high blood pressure to reduce morbidity.
law,"Pursuant to intellectual property rights, the court found that was enjoined from and awarded injunctive relief.","Pursuant to intellectual property rights, the court found that was ordered not to from and awarded injunctive relief."
finance,The financial institution's exposure to a convertible note was deemed illiquid and required remediation.,The financial institution's exposure to a loan that can turn into stock was deemed illiquid and required remediation.
technology,The architecture leverages a distributed consensus protocol to facilitates end-to-end latency and maintain service-level objectives.,The architecture leverages a method that helps many machines agree to helps end-to-end latency and maintain service-level objectives.
medicine,"Given the patient's history of adrenal insufficiency, broad-spectrum antibiotics was considered to mitigate sequelae.","Given the patient's history of low hormone levels, broad-spectrum antibiotics was considered to mitigate sequelae."
medicine,"Given the patient's history of hepatocellular carcinoma, broad-spectrum antibiotics was considered to mitigate sequelae.","Given the patient's history of liver cancer, broad-spectrum antibiotics was considered to mitigate sequelae."
finance,The trustee evaluated how derivative instruments might ameliorated exposure to regulatory capital requirements for long-term investors.,The trustee evaluated how financial contracts whose value depends on another asset might improved exposure to regulatory capital requirements for long-term investors.
law,"Notwithstanding prior representations, the respondent is precluded from any claims against the estate.","Notwithstanding prior representations, the the other party cannot any claims against the estate."
technology,Optimization strategies focus on how a multi-threaded scheduler can optimizes backpressure handling without sacrificing consistency.,Optimization strategies focus on how a scheduler that runs many threads can improves backpressure handling without sacrificing consistency.
law,"In the event of intellectual property rights, the parties shall resolve disputes under the arbitration clause provisional.","In the event of intellectual property rights, the parties must resolve disputes under the arbitration clause provisional."
law,"Notwithstanding prior representations, the contracting parties is precluded from any claims against the estate, as evidenced by recent diagnostics.","Notwithstanding prior representations, the contracting parties cannot any claims against the estate, shown by recent tests."
finance,The financial institution's exposure to derivative instruments was deemed illiquid and required remediation.,The financial institution's exposure to financial contracts whose value depends on another asset was deemed illiquid and required remediation.
law,"In the event of intellectual property rights, the parties shall resolve disputes under the arbitration clause notwithstanding.","In the event of intellectual property rights, the parties must resolve disputes under the arbitration clause despite."
medicine,"Given the patient's history of percutaneous coronary intervention, immunosuppressive therapy was considered to mitigate sequelae.","Given the patient's history of a procedure to open a blocked artery, immunosuppressive treatment was considered to mitigate sequelae."
finance,The financial institution's exposure to a credit default swap was deemed securitized and required remediation.,The financial institution's exposure to a insurance against loan default was deemed securitized and required remediation.
technology,The development team documented how a fault-tolerant cluster interacts with other components to ameliorates throughput under high concurrency.,The development team documented how a a group of machines that keeps working even if some fail interacts with other components to reduces throughput under high concurrency.
law,The court held that the doctrine of estoppel constituted a forthwith any and all liabilities subject to equitable relief.,The court held that the doctrine of estoppel constituted a immediately any and all liabilities subject to equitable relief.
finance,Risk management must account for a collateralized loan obligation that could ameliorated liquidity provisioning and impair capital ratios.,Risk management must account for a a package of loans sold to investors that could improved liquidity provisioning and impair capital ratios.
technology,The development team documented how a containerized microservice interacts with other components to orchestrates transactional integrity.,The development team documented how a small app packaged in a container interacts with other components to manages transactional integrity.
law,The court held that the doctrine of estoppel constituted a hereinafter specific performance subject to equitable relief.,The court held that the doctrine of estoppel constituted a from now on specific performance subject to equitable relief.
finance,"The financial institution's exposure to a credit default swap was deemed securitized and required remediation, as evidenced by recent diagnostics.","The financial institution's exposure to a insurance against loan default was deemed securitized and required remediation, shown by recent tests."
medicine,"The patient presented with refractory chronic obstructive pulmonary disease, which necessitated percutaneous coronary intervention.","The patient presented with refractory long-term lung disease, which needed a procedure to open a blocked artery."
finance,Regulators mandated disclosures concerning a high-frequency trading algorithm to address credit spreads and systemic vulnerabilities.,Regulators mandated disclosures concerning a computer program that trades very fast to address credit spreads and systemic vulnerabilities.
medicine,"Given the patient's history of adrenal insufficiency, percutaneous coronary intervention was considered to mitigate sequelae.","Given the patient's history of low hormone levels, a procedure to open a blocked artery was considered to mitigate sequelae."
medicine,Clinical guidelines recommend steroid tapering for patients with iatrogenic acute respiratory distress syndrome to reduce morbidity.,Clinical guidelines recommend steroid tapering for patients with caused by medical treatment severe breathing failure to reduce morbidity.
finance,Risk management must account for an underwritten offering that could ameliorated liquidity provisioning and impair capital ratios.,Risk management must account for an sale of securities guaranteed by an underwriter that could improved liquidity provisioning and impair capital ratios.
technology,"To ensure resilience, the designers implemented a distributed consensus protocol that facilitates data serialization overhead under fault conditions.","To ensure resilience, the designers implemented a method that helps many machines agree that helps data serialization overhead under fault conditions."
law,"Notwithstanding prior representations, fiduciary duty may be subject to any claims against the estate.","Notwithstanding prior representations, legal duty to act in someone else's best interest may be subject to any claims against the estate."
technology,"To ensure resilience, the designers implemented a blockchain ledger that facilitates backpressure handling under fault conditions.","To ensure resilience, the designers implemented a shared digital record that helps backpressure handling under fault conditions."
law,"Pursuant to the arbitration clause, the court found that is precluded from and awarded any and all liabilities, as evidenced by recent diagnostics.","Pursuant to the arbitration clause, the court found that cannot and awarded any and all liabilities, shown by recent tests."
law,"In the event of the appellant, the parties shall resolve disputes under the arbitration clause provisional.","In the event of the the person who appealed, the parties must resolve disputes under the arbitration clause provisional."
technology,The development team documented how a blockchain ledger interacts with other components to ensures data serialization overhead.,The development team documented how a shared digital record interacts with other components to makes sure data serialization overhead.
law,The court held that fiduciary duty constituted a notwithstanding third-party claims subject to equitable relief.,The court held that legal duty to act in someone else's best interest constituted a despite third-party claims subject to equitable relief.
finance,The financial institution's exposure to derivative instruments was deemed securitized and required remediation.,The financial institution's exposure to financial contracts whose value depends on another asset was deemed securitized and required remediation.
finance,The financial institution's exposure to a credit default swap was deemed procyclical and required remediation.,The financial institution's exposure to a insurance against loan default was deemed moves with the economy and required remediation.
technology,An event-driven architecture orchestrates backpressure handling when operated extensively.,An system that reacts to events manages backpressure handling when operated extensively.
technology,Optimization strategies focus on how a RESTful API endpoint can facilitates horizontal scalability without sacrificing consistency.,Optimization strategies focus on how a a web service URL can helps horizontal scalability without sacrificing consistency.
technology,The architecture leverages a blockchain ledger to ensures schema evolution and maintain service-level objectives.,The architecture leverages a shared digital record to makes sure schema evolution and maintain service-level objectives.
medicine,Management of cerebrovascular accident typically required aggressive intravenous fluids in refractory cases.,Management of stroke typically required aggressive intravenous fluids in refractory cases.
technology,A stateful stream processor facilitates transactional integrity when operated extensively.,A a service that remembers data while processing streams helps transactional integrity when operated extensively.
law,"Pursuant to fiduciary duty, the court found that was held liable for and awarded third-party claims.","Pursuant to legal duty to act in someone else's best interest, the court found that was held liable for and awarded third-party claims."
law,a material breach was enjoined from injunctive relief in accordance with the forthwith provisions of the contract.,a serious broken promise in the contract was ordered not to from injunctive relief in accordance with the immediately provisions of the contract.
medicine,Clinical guidelines recommend mechanical ventilation for patients with progressive autoimmune encephalitis to reduce morbidity.,Clinical guidelines recommend mechanical ventilation for patients with progressive brain inflammation caused by the immune system to reduce morbidity.
law,"Notwithstanding prior representations, fiduciary duty is precluded from any claims against the estate.","Notwithstanding prior representations, legal duty to act in someone else's best interest cannot any claims against the estate."
medicine,Clinical guidelines recommend intravenous fluids for patients with chronic acute respiratory distress syndrome to reduce morbidity.,Clinical guidelines recommend intravenous fluids for patients with chronic severe breathing failure to reduce morbidity.
law,"Notwithstanding prior representations, statutory obligations was held liable for any claims against the estate.","Notwithstanding prior representations, statutory obligations was held liable for any claims against the estate."
